[
  {
    "id": "m365-message-trace-anomaly",
    "name": "Microsoft 365 Message Trace Anomaly",
    "pack_id": "email",
    "capability": "email.message_trace",
    "required_sources": [
      "email.message_trace"
    ],
    "required_fields": {
      "email.message_trace": [
        [
          "SenderAddress",
          "sender"
        ],
        [
          "RecipientAddress",
          "recipient"
        ],
        [
          "Subject",
          "subject"
        ],
        [
          "Status",
          "status"
        ],
        [
          "MessageId",
          "MessageID",
          "message_id"
        ]
      ]
    },
    "priority": 84,
    "severity": "medium",
    "mitre_techniques": [
      "T1566"
    ],
    "why": "Abnormal mail delivery patterns, senders, recipients, or statuses can provide evidence of phishing or mail abuse.",
    "implementation": "splunk_spl",
    "requires_enterprise_security": false
  }
]
