[
  {
    "id": "dns-suspicious-resolution",
    "name": "Suspicious DNS Resolution Activity",
    "pack_id": "network",
    "capability": "network.dns",
    "required_sources": [
      "network.dns"
    ],
    "required_fields": {
      "network.dns": [
        [
          "query",
          "query_name",
          "domain"
        ],
        [
          "src_ip",
          "client_ip"
        ],
        [
          "answer",
          "response",
          "dest_ip"
        ]
      ]
    },
    "priority": 85,
    "severity": "medium",
    "mitre_techniques": [
      "T1071.004"
    ],
    "why": "Unusual DNS patterns can indicate command-and-control, tunneling, or malicious infrastructure access.",
    "implementation": "splunk_spl",
    "requires_enterprise_security": false
  },
  {
    "id": "firewall-risky-inbound",
    "name": "Risky Inbound Firewall Activity",
    "pack_id": "network",
    "capability": "network.firewall",
    "required_sources": [
      "network.firewall"
    ],
    "required_fields": {
      "network.firewall": [
        [
          "src_ip",
          "source_ip"
        ],
        [
          "dest_ip",
          "destination_ip"
        ],
        [
          "dest_port",
          "destination_port"
        ],
        [
          "action",
          "result"
        ]
      ]
    },
    "priority": 87,
    "severity": "high",
    "mitre_techniques": [
      "T1190"
    ],
    "why": "Unexpected inbound access to sensitive services can expose exploitable systems or indicate probing.",
    "implementation": "splunk_spl",
    "requires_enterprise_security": false
  },
  {
    "id": "network-device-config-change",
    "name": "Network Device Configuration Change",
    "pack_id": "network",
    "capability": "network.infrastructure",
    "required_sources": [
      "network.infrastructure"
    ],
    "required_fields": {
      "network.infrastructure": [
        [
          "user",
          "username"
        ],
        [
          "command",
          "message",
          "action"
        ],
        [
          "host",
          "device",
          "device_name"
        ]
      ]
    },
    "priority": 82,
    "severity": "medium",
    "mitre_techniques": [],
    "why": "Unplanned network-device configuration changes can alter routing, access controls, or monitoring visibility.",
    "implementation": "splunk_spl",
    "requires_enterprise_security": false
  }
]
